网站链接,文章标题,文章摘要
https://ieeexplore.ieee.org/document/10000335/,The Effects of Jamming on Global Positioning System (GPS) Accuracy for Unmanned Aerial Vehicles (UAVs),"Unmanned aerial vehicles (UAVs) are vulnerable to a number of threats, including jamming. Jamming is the act of intentionally directing electromagnetic energy towards a communication and / or navigation system to disrupt or prevent signal transmission and reception. Global Navigation Satellite System (GNSS) jammers transmit interference signals in the frequency band used for satellite navigation. Frequency Selective Surface (FSS) filter as a potential solution to mitigate the jamming activity. The effectiveness of FSS depends on the incidence angle of the jamming signals. It is important to characterize the GPS performance of the UAV in the absence of the FSS filter, which will be used as a benchmark for modelling the appropriate FSS filter. Hence, this paper aims to investigate preliminary effects of jamming signal on UAV. The purpose of this research is to investigate the effects of Global Positioning System (GPS) jamming on UAVs based on two different conditions, namely, varying times and rotation angles. The study was conducted using GPS simulation in an anechoic chamber to prevent external interferences and multipath. Different estimated probable error (EPE) patterns are observed at different times due to the GPS satellite constellation being dynamic. This indicates that GPS accuracy is time-dependent. The results also show that the presence of a jammer imposes a significant effect on GPS accuracy when the jammer signal reaches -89 dBm. The significance of this work is to provide a solution to prevent GPS jamming and ensure safe and reliable UAV navigation by using a frequency selective surface (FSS) filter for future work."
https://ieeexplore.ieee.org/document/10430778/,GPS Spoof and Detect in Ardupilot Simulating UAVs,"The usage and application of Unmanned Aerial Vehicles (UAVs) are continuously increasing for various purposes and services, including surveillance, goods delivery, and military operations. However, as the usage of such devices grows, the security threats associated with them also grows. Therefore, it is essential to protect these devices against the cyber attacks to ensure their safe, secure, and reliable usage. This paper first discusses different types of possible cyber attacks on these devices and provides corresponding defense mechanisms. Furthermore, it explains the implementation of Global Positioning System (GPS) spoofing in the Ardupilot simulator. The paper offers a detailed guide on installing Ardupilot and utilizing the ""fakegps"" module to execute GPS spoofing. The process of setting up a flight path and executing GPS spoofing is thoroughly explained. The experimental results demonstrate the successful implementation and detection of GPS spoofing in Ardupilot. Overall, this paper throws light on the potential dangers of GPS spoofing and emphasizes the importance of securing drones to defend against such attacks."
https://ieeexplore.ieee.org/document/5174709/,A vision based onboard approach for landing and position control of an autonomous multirotor UAV in GPS-denied environments,We describe our work on multirotor UAVs and focus on our method for autonomous landing and position control. The paper describes the design of our landing pad and the vision based detection algorithm that estimates the 3D-position of the UAV relative to the landing pad. A cascaded controller structure stabilizes velocity and position in the absence of GPS signals by using a dedicated optical flow sensor. Practical experiments prove the quality of our approach.
https://ieeexplore.ieee.org/document/10431039/,Real Time Vision Based Obstacle Avoidance for UAV using YOLO in GPS Denied Environment,"This paper discussed cost-effective vision-based obstacle avoidance for Unmanned Aerial Vehicles (UAVs) operating in GPS-denied environments. The system combines the You Only Look Once (YOLO) architecture with stereo vision cameras (OAK-D Lite), a Raspberry Pi computer, and a flight controller unit (Pixhawk-Cube). Navigating safely through obstacles becomes challenging for UAVs in GPS-denied environments. To address this issue, the drone is configured in altitude hold mode, and the system is trained on the Common Objects in Context (COCO) dataset, enabling it to recognize objects and analyze the surrounding areas to identify free spaces. By doing so, the drone can traverse an obstacle-free path. The detected obstacle information is then utilized to generate avoidance trajectories, allowing the UAV to navigate around obstacles safely. Real-time testing of the proposed technique demonstrates its efficacy in detecting and avoiding obstacles within a threshold distance of 2 meters, with an error rate of 10%. The drone’s relative speed is configured at 2 m/s during these tests."
https://ieeexplore.ieee.org/document/10494497/,Assessing supervised machine learning in detecting GPS spoofing attacks on UAV application use-cases,"The use of Unmanned Aerial Vehicles (UAVs) is growing rapidly for multiple purposes, e.g., UAVs play a crucial role in aerial surveillance for road-traffic monitoring or emer-gency response, in smart agriculture for precision fertilization and irrigation, and in delivery of goods. However, due to the increasing attention they draw, UAVs become attractive targets for attackers, e.g., the widespread reliance on Global Positioning System (GPS) technology particularly opens the door for GPS spoofing that manipulates the GPS signals. Machine learning (ML) has revolutionized the field of UAVs security providing the means to analyze data towards detecting attacks, such as unauthorized interference in their navigation systems. In this paper, we elaborate on an open data-set containing GPS relative information regarding different UAV flights, either clear or under spoofing attack, and deploy a number of well-known methods of supervised machine learning as a means of detecting the attacks. We derive quantitative results indicating accuracy, precision, recall, f-score, False Alarm Rate (FAR), Miss Detection Rate (MDR), as well as detection time. Our interest focuses on assessing these methods in the light of diverse UAV application use-cases and highlighting tradeoff issues regarding the metrics of accuracy and detection time. We particularly consider the use-cases of road-traffic surveillance, precision agriculture, and delivery of goods. Our study uncovers the importance of mixing and matching the appropriate ML method in the use-case context balancing complexity with time requirements."
https://ieeexplore.ieee.org/document/6530932/,Combined communication and radio navigation system for small UAVs,"Unmanned aerial vehicle systems are in a rapid spread not only in the military but in civilian application areas as well. The safety of these systems is more important when those are flying over civilized areas and leave the restricted flight territories. Two main areas are playing a key role in UAV safety: navigation and supervision. Most of the systems are using GPS sensors to navigate and COTS radio communication system for communication. When GPS system is jammed or the sensor fails the aircrafts have to use alternate navigation method. One solution is radio navigation. Our idea is a proprietary radio communication system which uses software defined radio technology for low power, long range communication and by the aid of multi antenna radio direction finding it can also assist the navigation system by supplying directional and distance information. In our paper we present the system concepts and suggested communication and radio navigation method."
https://ieeexplore.ieee.org/document/9679652/,UAV Antenna Automatic Tracking System Based on Arduino,"To address the problems of short data link signal distance, poor pointing accuracy, and the real-time performance of ordinary directional antennas during the flight of small and medium-sized unmanned aerial vehicles (UAVs), an Arduino-based UAV antenna automatic tracking system is proposed in this study. An ATMEG328P main controller is used to control the overall system, GPS is employed to obtain the real-time position of a UAV, a coordinate system with the center of the earth as the origin is established to calculate the relative position of the aircraft and the ground, and virtual GPS frame data are generated via NMEAGNE for the tracking simulation. Moreover, a radio is utilized to collect and test the POS data. The experimental results show that the data link is stable, and the range-increasing effect is obvious when the system is tracking. The optimization program achieves high-precision tracking for aerial targets within 0.5 m and keeps the image signal clear up to 10 km through 100 MW data transmission. Moreover, the data link signal can be maintained above 90%."
https://ieeexplore.ieee.org/document/7943444/,Data fusion and unmanned aerial vehicles (UAVs) for first responders,"The commercial unmanned aerial vehicle (UAV) market is dominated by vehicles designed specifically for photography or surveillance. While relatively affordable and readily available, these UAVs have limited effectiveness in the field of emergency response due to limited sensing capabilities. These existing vehicles can be improved through sensor integration to make them applicable to emergency response. In this article, we demonstrate one example of altering an existing commercial-off-the-shelf UAV to assess disasters involving radiation by combining radiation detection, vision, and a global positioning system (GPS). The challenges associated with using low cost commercial UAVs in disaster assessment, including data transmission range, endurance, payload, and control range are also discussed."
https://ieeexplore.ieee.org/document/9337634/,GPS/INS Integrated Navigation for Quadrotor UAV Considering Lever Arm,"GPS/INS combination is a commonly used integrated navigation mode. Inertial navigation system (INS) is a typical navigation mode, which can complete the acquisition of navigation parameters, but it will cause error accumulation problem when it is used alone, so using GPS to provide INS with a useful correction information. This article considers that the GPS antenna and the INS are not in the same position in the actual UAV integrated navigation system. Therefore, there is a lever arm that makes the observation equation nonlinear, In order to solve the problems, an improved filter is adopted. Finally, the data are used for comparative experiments, the stability of the algorithm is verified."
https://ieeexplore.ieee.org/document/10397953/,Investigating Patterns of UAV Attacks for Building Secure UAV Network,"Unmanned Aerial Vehicles are remotely handled for fulfilling tasks like photojournalism, security, rescue efforts, and even package deliveries. These gadgets have a variety of sensors and cameras that enable them to gather data and provide real-time images to their administrators. These devices are vulnerable to cyber-attacks that can lead to hacking of devices, resulting in data theft, identity theft and spoofing. Important information carried by unmanned aerial vehicle devices can be intercepted by unauthorized users to destroy the network transmission. This research paper performs an experimental study on generating traffic patterns of unmanned aerial vehicle communication for cyber-attacks. The unmanned aerial vehicle traffic pattern is compared in global positioning system jamming and spoofing attacks for analyzing battery state, system power, logger status and computational load. The achieved results indicate the critical parameters of the network that are to be considered while framing security policies for unmanned aerial vehicle communication."
https://ieeexplore.ieee.org/document/10423544/,Securing the Skies: An UAV-Based Framework for Safe and Authenticated Product Delivery Using QR Codes,"Advancements in the field of Image processing, remotely controlled Unmanned Aerial Vehicle (UAV) and battery technologies it has become a promising solution to the modern world when it comes to surveillance and product delivery. In this study a framework is designed with a UAV and Quick Response (QR) verification system where the route and the mission planning of the UAV are set by an operator using a computing device equipped with the UAV. Where onwards the UAV continue its mission and reaching to a particular delivery location the QR Scanner become online and upon successful scanning and verification the chamber gets opened and the product gets delivered. The UAV drone then continues to the next set of waypoints by following the same protocol. The drone ensures a smooth and effective mission execution by returning to its home location after completing the entire journey. The successful execution of the delivery task was greatly aided by the use of the QR verification method that employed in this study."
https://ieeexplore.ieee.org/document/9915682/,Robust Sensor Fusion for Autonomous UAV Navigation in GPS denied Forest Environment,"Forestry and precision biodiversity data collection using UAVs can be cost-effective and time efficient solution. However, navigating in the forest canopy autonomously can be quite challenging because of its GPS denied environment, cluttered, dynamic, and large scale. Most of the commercial UAVs used in forest applications apply GPS-based navigation which is not suitable for navigating under the canopy. In this paper, an autonomous UAV flight mission in a cluttered forest-like canopy environment is presented. A robust multi-sensor fusion-based robust navigation method which has failure detection features is proposed to enable safe and reliable autonomous navigation. The autonomy architecture utilizes the navigation, planning, and control capabilities of the UAV in a simultaneous manner. To achieve autonomous missions in forest environment, the proposed system has been tested rigorously in a simulated environment and the result shows the capability of autonomous flights in such a challenging environment. The performance of the autonomous flight was evaluated based on mean velocity and path length with respect to the increasing number of trees in the forest."
https://ieeexplore.ieee.org/document/10338915/,Blockchain-Based Heuristic Study to Secure UAVs From GPS Spoofing Signals and External Attacks,"This paper presents a heuristic study to introduce the use of blockchain technology for securing Unmanned Aerial Vehicle Systems (UAVs) against security threats, for example Global Positioning System (GPS) spoofing and improving their efficiency. We leverage a unique combination of “Write Once, Read Many (WORM),” and “Multi-Factor Authentication (MFA)” to create a fortified security infrastructure. Our code results validate the robustness of this combined approach, demonstrating its superiority in providing enhanced protection against data tampering and unauthorised access. The study concludes by contrasting the stand-alone WORM technique with the synergistic WORM+MFA method, evaluating them on key metrics such as level of security, cost of implementation, and user convenience to secure UAVs from GPS spoofing signals and external attacks."
https://ieeexplore.ieee.org/document/10109486/,A Development of an autonomous Unmanned Aerial Vehicle (UAV) that can locate and map people in flooded areas using image processing and GPS technology,"This study aims to equip an unmanned aerial vehicle (UAV), also called drone, with an onboard microcomputer that can perform autonomous surveying with image processing for human detection and quantification, Global Positioning System (GPS) technology for location tagging of detected people, as well as LiDAR sensors for obstacle detection to be used for obstacle avoidance to achieve an enhanced autonomous flight. A user interface for the system will also be developed to display the data being gathered by the drone, namely the detected people and their location, as well as monitor what the drone sees when in flight. This will be used to aid search and rescue operations in flooded areas and aims to speed up the victim search process. The study includes the development of the drone, the human detection and quantification model, the obstacle detection and avoidance algorithm, and the data display on a ground station’s Graphical User Interface (GUI)."
https://ieeexplore.ieee.org/document/10722561/,Characterization of Lightweight GPS Disciplined Oscillators for Distributed UAV Measurement Applications,"With an increasing variety of measurement applications using sensing nodes on unmanned aerial vehicles (UAVs), global positioning system (GPS) and global navigation satellite system (GNSS) disciplined oscillators (GPSDOs, GNSSDOs) are an appealing solution for precise wireless inter-device synchronization. Typically evaluated under laboratory conditions by analyzing the 10 MHz and 1 pulse per second (PPS) reference signal stability, these test methods overlook airborne oscillator performance. This paper characterizes lightweight GNSSDO models for flight suitability using a measurement system based on software defined radios (SDRs). We analyze reference signal stability under controlled GNSS signal impairments to predict performance and measurement precision loss in dynamic operational modes. Additionally, we assess behavior under the impacts caused by operating the UAV, as well as typical flight vibrations and accelerations outlined in the standard for payload devices."
https://ieeexplore.ieee.org/document/6616189/,Distributed task allocation and coordination scheme for a multi-UAV sensor network,"Unmanned Aerial Vehicle (UAV) networks require successful mission execution, which is dependent on task planning and control. In this paper, we propose a distributed task allocation algorithm for a multi-UAV sensor network for sensing thorium intensities in the coastal areas of India. A power-aware coordination and planning approach is used to coordinate the activities of multiple UAVs. Depending on the availability of resources in each sensing UAV unit, each UAV initiates a task-scheduling algorithm and distributes its remaining tasks dynamically to other UAVs. The control station sends control information to the UAVs and receives the sensed parameters along with the location information from each UAV. The task allocation algorithm was simulated successfully using a network of static motes. The network was more effective and efficient with the use of this task allocation algorithm, thus contributing to improved mission execution in UAV networks."
https://ieeexplore.ieee.org/document/8729752/,Towards autonomous ocean observing systems using Miniature Underwater Gliders with UAV deployment and recovery capabilities,"This paper presents preliminary results towards the development of an autonomous ocean observing system using Miniature Underwater Gliders (MUGs) that can operate with the support of Unmanned Aerial Vehicles (UAVs) and Unmanned Surface Vessels (USVs) for deployment, recovery, battery charging, and communication relay. The system reduces human intervention to the minimum, revolutionizing the affordability of a broad range of surveillance and data collection operations. The MUGs are equipped with a small Variable Buoyancy System (VBS) composed of a gas filled piston and a linear actuator powered by brushless DC motor and a rechargable lithium ion battery in an oil filled flexible enclosure. By using a fully pressure tolerant electronic design the aim is to reduce the total complexity, weight, and cost of the overall system. A first prototype of the VBS was built and demonstrated in a small aquarium. The electronic components were tested in a pressure testing facility to a minimum of 20bar. Preliminary results are promising and future work will focus on system and weight optimization, UAV deployment/recovery strategies, as well as sea trials to an operating depth of 200m."
https://ieeexplore.ieee.org/document/10873900/,An Analysis on the Energy Consumption of Coverage Path Planning Algorithms on Multiple UAVs,"One of the greatest limitations that aerial vehicles face nowadays is the limitation in flight durations. This issue becomes more critical in search applications where a specific area is required to be covered through drone using Coverage Path Planning (CPP) algorithms. Searching in bigger regions multiple drones are often deployed to cover an area. This work utilized multiple combinations of UAVs using different CPP algorithms to find the most optimal choice to cover a region. There were four simulation scenarios with the above-mentioned combinations which were evaluated for multiple parameters. These parameters include coverage completeness, coverage time, battery consumption and the number of maneuvers required to cover the region using ROS Gazebo Simulation and Qground Control. The data retrieved from the simulation results were then compared to determine the best CPP method. It was observed from the results that the Expanding Spiral method proved to be the fastest CPP method with the least coverage time, lowest battery consumption and least number of turns."
https://ieeexplore.ieee.org/document/8927929/,Efficient Data Collection in Large-Scale UAV-aided Wireless Sensor Networks,"Dispatching unmanned aerial vehicles (UAVs) to collect sensor data from distributed sensor networks is expected to significantly improve the data collection efficiency of traditional Wireless Sensor Networks (WSNs). In this paper, we consider data collection for distributed large-scale UAV-aided WSNs. We first divide the target area into clusters, and determine the cluster head election and data forwarding rules within the cluster based on the value of information (VoI) and power of nodes. Then sensor nodes collect information around by event-driven, and the UAV acts as a mobile sink to collect the data of cluster head nodes. The direct future prediction (DFP) model is used to plan the UAV path, which allows the UAV to handle multitarget tasks, maximizing the total VoI collected while ensuring that the UAV is charged at low power. Simulation results show that our DFP model is superior to traditional Q-Learning and Deep Q-Learning Network (DQN) in performance."
https://ieeexplore.ieee.org/document/10027832/,Are UAVs' Flight Controller Software Reliable?,"Unmanned Ariel Vehicles (UAVs) are recently being studied and worked upon to make them safe and secure for the upcoming expected growth of UAVs in civilian airspace. These efforts resulted in services such as Unmanned Aircraft System Traffic Management (UTM) or U-space in Europe, providing services to regularize and organize (pre-flight), monitor/track (during the flight) drones in civilian airspace while avoiding collisions. The primary source of information for tracking drones during flight is GPS positioning data, which is used and filtered (after being fused with the other sensors' data) by the flight controller software to estimate the vehicle position, velocity, and orientation. Extended Kalman Filter (EKF), which is used in most open-source flight controllers such as PX4, is responsible for doing this estimation. This makes EKF a critical component of the whole system. This paper aims to study the reliability of flight controllers and their core component, namely EKF, in the presence of GPS-related failures. To do so, we injected faults (i.e., we emulated failures indeed) on GPS raw data ranging from small noises to complete failure (missing GPS signals) and GPS spoofing to study their impact on EKF estimation and on the system as a whole. We observed that for small faults (e.g., Fixed Small Noise or Freeze Values), EKF is efficient and can tolerate/compensate the faults, whereas there is a gap in the filter for handling bigger anomalies (e.g., Invalid Values or Random Values) in the GPS data. Our research also clearly demonstrates that GPS faults lasting 30 seconds or more have a noticeable effect, which represents a clear vulnerability since GPS can be subject of cyber attacks such as spoofing. The quantification of the impact of GPS-related failures in the PX4 is an essential step to measure and improve the reliability of UAVs' flight controller software."
